{
  "schema_version": "1.0",
  "id": "MTH-JURIMETRIC-CODING",
  "title": "Regex-based jurimetric coding of decision summaries (21 categories)",
  "description": "The coding engine in the water-law-dataset repository. Too heavy and data-dependent for the browser; requires the raw corpus. Not yet wrapped as an experiment.",
  "source_ids": [
    "SRC-WLD-REPO",
    "SRC-WLD-CONTEXT"
  ],
  "required_inputs": [
    "Raw decision summaries in four languages (not available here)"
  ],
  "assumptions": [
    "Keyword rules in utils/jurimetric_coding.py reflect the intended categories."
  ],
  "execution_environment": "workflow",
  "associated_outputs": [
    "theme shares per country"
  ]
}
